Title,Link,Comment Count,Date
"I am a foodpanda rider and my torchlight was stolen. I just installed this torchlight today as I almost died yesterday. Today, as usual, I left my bike to send food to a home (going up the lift). When I came back down, less than 2 mins. My torchlight was gone. Posting this before I might die",https://i.redd.it/wdgghqtcysk61.jpg,294,1614801381.0
Thought I was smart by paying $7.99/mth for FoodPanda Pro subscription... Just found out my delivery fees are often higher than free users. 😳,https://www.reddit.com/gallery/m5hf6w,98,1615831582.0
"Chicken rice with no chicken? Man rages at Foodpanda for 'wrong' order, gets chided online for not reading properly",https://www.asiaone.com/singapore/chicken-rice-no-chicken-man-rages-foodpanda-wrong-order-gets-chided-online-not-reading?amp,34,1615307451.0
"Foodpanda Customer Asks About Missing Rice In Bak Kut Teh Set, Told To Send Query In English",https://mustsharenews.com/foodpanda-bak-kut-teh/,55,1613909519.0
Meet the 31-year-old Frenchman who runs foodpanda in Singapore,https://cnaluxury.channelnewsasia.com/people/luc-andreani-managing-director-foodpanda-apac-14339838,19,1615207490.0
Foodpanda rider asked to cycle from Tampines to Paya Lebar for $5.20 after customer leaves wrong address,https://stomp.straitstimes.com/singapore-seen/foodpanda-rider-asked-to-cycle-from-tampines-to-paya-lebar-for-520-after-customer,18,1614417657.0
Police investigating case of 'harassment' involving foodpanda delivery orders at Joo Seng,https://www.channelnewsasia.com/news/singapore/foodpanda-delivery-prank-order-joo-seng-upper-aljunied-spf-14243378,27,1613864195.0
Foodpanda rider telling me that the shop is closed so he processes the order as delivered but I received nothing. Now foodpanda support is refusing to refund me. What can I do here?,https://www.reddit.com/gallery/lhmavv,31,1613084053.0
[Rant] Foodpanda's customer service is a terrible joke,https://www.reddit.com/r/singapore/comments/l38wf2/rant_foodpandas_customer_service_is_a_terrible/,34,1611421792.0
Customer Service : Deliveroo vs Foodpanda vs Grab,https://i.redd.it/7pkwbe31rb261.png,96,1606747900.0
Foodpanda deliveryman in Bukit Panjang receives order to pick up at Hougang for S$5,https://mothership.sg/2020/11/foodpanda-delivery-to-hougang/,86,1606249545.0
"Foodpanda/ grabfood delivery riders, are you affected when a customer gets refunded for their order?",https://www.reddit.com/r/singapore/comments/l9xj9p/foodpanda_grabfood_delivery_riders_are_you/,5,1612192796.0
"Jail for woman who ordered S$2,285 worth of food on Foodpanda with ex-boss’s credit card details",https://www.todayonline.com/singapore/jail-woman-who-ordered-s2285-worth-food-foodpanda-ex-bosss-credit-card-details,8,1610497252.0
Foodpanda apologises after rider asked to travel 20km on bicycle to pick up food,https://www.asiaone.com/singapore/foodpanda-apologises-after-rider-asked-travel-20km-bicycle-pick-food,19,1606934385.0
Thousand lumens grab rider has moved to Foodpanda,https://i.redd.it/2ektkw286z061.jpg,17,1606159692.0
"Foodpanda not bothering to help me recover the account attached to my phone number. Looks like I'm not ordering from them ever, because I simply can't.",https://i.redd.it/n0oqfnvawgn51.png,74,1600272503.0
Ode to foodpanda guy.,https://www.reddit.com/r/singapore/comments/j086xn/ode_to_foodpanda_guy/,27,1601163545.0
"Foodpanda S'pore hiring a 'chief makan officer', S$1,000 salary & S$5,000 food allowance",https://mothership.sg/2020/11/foodpanda-chief-makan-officer/,13,1606603538.0
Got this rude and ridiculous email from FoodPanda’s customer service after getting only 2/5 ordered items; anyone else got similar experiences? (sharing friend’s FB post),https://www.reddit.com/gallery/ijcojx,61,1598822948.0
Foodpanda man waves at the crowd during mobile column 2020,https://www.youtube.com/watch?time_continue=1&v=MP6XX2Q0rKU,46,1596982963.0
Foodpanda Overcharging?,https://www.reddit.com/r/singapore/comments/jaw985/foodpanda_overcharging/,18,1602689949.0
Man gets jail for ordering more than S$700 worth of food from GrabFood and Foodpanda without paying,https://www.channelnewsasia.com/news/singapore/man-jailed-700-grabfood-foodpanda-without-paying-13120562,33,1600366673.0
Stacking deliveries on FoodPanda,https://www.reddit.com/r/singapore/comments/jct4pm/stacking_deliveries_on_foodpanda/,13,1602960918.0
Yet another complain about foodpanda and PSA against buying their vouchers,https://www.reddit.com/r/singapore/comments/in0qmo/yet_another_complain_about_foodpanda_and_psa/,28,1599339745.0
Spotted this customized(not sure if official) Foodpanda uniform,https://i.redd.it/z05nyzcauep51.jpg,24,1601119207.0
Foodpanda customer service,https://www.reddit.com/r/singapore/comments/ifoxp0/foodpanda_customer_service/,75,1598304345.0
"S'pore teen, 17, arrested for allegedly cheating Foodpanda of S$14,000 by making fraudulent refund claims",https://mothership.sg/2020/08/teenager-cheat-food-panda/,35,1598343072.0
Foodpanda delivery rider who 'gate-crashed' NDP mobile column was celebrating his birthday,https://www.straitstimes.com/singapore/foodpanda-delivery-rider-who-gate-crashed-ndp-mobile-column-was-celebrating-his-birthday,16,1597092666.0
Haha... FoodPanda still likes riddling their users...,https://v.redd.it/8gmclm7nwi151,46,1590708171.0
Foodpanda Pro,https://www.reddit.com/r/singapore/comments/i43fnh/foodpanda_pro/,33,1596654927.0
Foodpanda collaborates with ST Engineering on drone food delivery trials,https://www.channelnewsasia.com/news/singapore/foodpanda-collaborates-st-engineering-on-drone-food-deliveries-13018106?cid=youtube_cna_social_29012018_cna,11,1597352939.0
S'pore Foodpanda customer service asks customer who needs help with wrong order to solve riddle first,https://mothership.sg/2020/05/foodpanda-riddle/,34,1589539824.0
[Rant] Bad experience with Foodpanda,https://www.reddit.com/r/singapore/comments/gh1w8u/rant_bad_experience_with_foodpanda/,29,1589147701.0
Auntie knows the real deals - foodpanda ad,https://www.youtube.com/watch?v=YkCZF5sXx3I&feature=youtu.be,4,1599485150.0
"Zaobao: Grabfood charges merchants 25%-30% commission, foodpanda 30%-35%, Deliveroo 25%-30%",https://www.reddit.com/r/singapore/comments/gfux0i/zaobao_grabfood_charges_merchants_2530_commission/,36,1588979454.0
foodpanda waives commissions for one month for Singapore hawkers new to app,https://www.businesstimes.com.sg/garage/foodpanda-waives-commissions-for-one-month-for-singapore-hawkers-new-to-app,21,1590170722.0
"Resources of food delivery other than GrabFood, FoodPanda and Deliveroo",https://www.reddit.com/r/singapore/comments/fy6han/resources_of_food_delivery_other_than_grabfood/,17,1586515052.0
FoodPanda deliveryman Batman slashed by colleague in a fight,https://www.channelnewsasia.com/news/singapore/batman-suparman-foodpanda-deliveryman-slashing-jail-caning-11807176?cid=fbcna&fbclid=IwAR1ITTtBI-Rn96l8SZKd5Qe6byuWULWHYRt2DEXkrERNJVHHqzk1xA35NZ8,78,1565785642.0
RANT- The issue of Delivery Pranks on Food Delivery Riders,https://www.reddit.com/r/singapore/comments/l2t9bj/rant_the_issue_of_delivery_pranks_on_food/,153,1611367483.0
Top 10 anime betrays,https://i.redd.it/i6ggg8xmzmg61.jpg,48,1612985759.0
"WTF, HDL delivery available now on foodpanda",https://i.redd.it/ox0bo5apn9d41.jpg,17,1580135751.0
He's still worthy,https://i.redd.it/4j48gsrp4zi61.jpg,21,1614004446.0
Habis! My foodpanda driver tried to deliver my lunch but ended up swimming to Malaysia! Send help! Activate the NSF navy!,https://i.imgur.com/yKukBnP.jpg,24,1569761940.0
RIP Foodpanda Customer Support. No need to pang kang liao.,https://i.imgur.com/WEH6WDE.jpg,50,1564831137.0
Anyone got a contact number for foodpanda or something?,https://www.reddit.com/r/singapore/comments/g7nk3e/anyone_got_a_contact_number_for_foodpanda_or/,4,1587818221.0
"AirAsia CEO Announces Entry To S'pore's Food Delivery Market, Marking First Overseas Foray",https://vulcanpost.com/734673/airasia-food-delivery-coming-to-singapore/,30,1613659657.0
Hardworking man in S’pore makes double money hustling for GrabFood & Foodpanda = Grabpanda,https://mothership.sg/2019/07/grabfood-foodpanda-grabpanda/,19,1562956254.0
Working as a food delivery rider - grab vs panda,https://www.reddit.com/r/singapore/comments/lv4av2/working_as_a_food_delivery_rider_grab_vs_panda/,6,1614617533.0
Best cash back credit card setup in Singapore (and what is the best cashback for bus/MRT and utilities?),https://www.reddit.com/r/singapore/comments/ljj266/best_cash_back_credit_card_setup_in_singapore_and/,29,1613312620.0
Foodpanda rider being investigated by police for allegedly cheating customer in Punggol,https://www.straitstimes.com/singapore/foodpanda-rider-being-investigated-by-police-for-allegedly-cheating-customer-in-punggol,14,1562339022.0
"[PSA] If you care about your money, please avoid putting them into Grab Pay.",https://www.reddit.com/r/singapore/comments/k4aver/psa_if_you_care_about_your_money_please_avoid/,104,1606816296.0
Customer receives crude messages after Foodpanda's Instagram account hacked,https://www.straitstimes.com/singapore/customer-receives-crude-messages-after-foodpandas-instagram-account-hacked,8,1563305772.0
"Man who’s neither police nor NEA officer demands IC from FoodPanda rider for smoking, S’poreans react strongly",https://mothership.sg/2019/01/foodpanda-smoking-drama/,18,1546644306.0
This uncle delivered my food to me again. mentioned that he has more than 60+ collection of rare soft toys in his apartment and he has never thought of putting the toys up for sale as it is his hobby.RESPECT to him for taking pride in his work😄😄😄,https://i.redd.it/j3zxrexld6161.jpg,27,1606246921.0
Radio deejay’s attempt to slam FoodPanda backfires,https://coconuts.co/singapore/news/radio-deejays-attempt-slam-foodpanda-backfires-delivery-rider-explains-side-story/,21,1529583783.0
"Analysis of 9 months of food order data from foodpanda, Deliveroo, Domino's and UberEats.",https://ichait.github.io/oloviz/,25,1527691655.0
"Food Delivery Riders (2019) – How Much Can You Make as a GrabFood, Foodpanda, Honestbee or Deliveroo rider?","https://blog.moneysmart.sg/career/food-delivery-riders-grabfood-foodpanda-deliveroo-rider/?utm_campaign=coschedule&utm_source=facebook_page&utm_medium=MoneySmart&utm_content=Food%20Delivery%20Riders%20(2019)%20-%20How%20Much%20Can%20You%20Make%20as%20a%20GrabFood,%20Foodpanda,%20Honestbee%20or%20Deliveroo%20rider%3F",9,1551865845.0
"Some questions regarding Grabfood, Foodpanda, Deliveroo delivery job",https://www.reddit.com/r/singapore/comments/9jnhyu/some_questions_regarding_grabfood_foodpanda/,12,1538174225.0
"Any UberEats, Deliveroo or Foodpanda bicycle couriers here? Looking to do food delivery as a part-time stint for a month or two. Would appreciate your shared experiences here!",https://www.reddit.com/r/singapore/comments/6yl44i/any_ubereats_deliveroo_or_foodpanda_bicycle/,19,1504788897.0
41 days to receive an email reply from FoodPanda. Anyone has a longer record?,https://www.reddit.com/r/singapore/comments/91qqw2/41_days_to_receive_an_email_reply_from_foodpanda/,15,1532544296.0
Foodpanda Vs UberEats Vs Deliveroo Riders,https://www.reddit.com/r/singapore/comments/76brl3/foodpanda_vs_ubereats_vs_deliveroo_riders/,23,1508011895.0
I wonder if this happens in Singapore: A restaurant is claiming it got 'shadowbanned' by Grabfood because of its small commission,https://i.imgur.com/LcNsCdL.jpg,129,1591388132.0
Foodpanda/Deliveroo/Ubereats as a cyclist,https://www.reddit.com/r/singapore/comments/6rj235/foodpandadeliverooubereats_as_a_cyclist/,13,1501862653.0
Foodpanda or Deliveroo?,https://www.reddit.com/r/singapore/comments/4srvwl/foodpanda_or_deliveroo/,23,1468507198.0
Experienced being a food panda rider using a car,https://www.reddit.com/r/singapore/comments/iissyw/experienced_being_a_food_panda_rider_using_a_car/,36,1598738282.0
"Foodpanda service down on Sunday, as wet weather causes 12% surge in orders",http://www.straitstimes.com/singapore/foodpanda-services-down-on-sunday-as-wet-weather-causes-12-surge-in-orders,1,1515967661.0
A rant on Grabfood,https://www.reddit.com/r/singapore/comments/fvgcu3/a_rant_on_grabfood/,221,1586132344.0
Grab suspends their food subscription services during this period?,https://www.reddit.com/r/singapore/comments/g8bgq2/grab_suspends_their_food_subscription_services/,69,1587921984.0
Grab refutes claims it ‘quietly’ stopped popular food delivery subscription plan,https://www.todayonline.com/singapore/grab-refutes-claims-it-quietly-stopped-popular-food-delivery-subscription-plan,78,1588067501.0
Nice to see these companies putting competition aside during these times.,https://i.redd.it/rudhh5zw7ro41.png,40,1585142715.0
Anyone still using GRAB? How has your usage of it changed since the recent removal of subscription?,https://www.reddit.com/r/singapore/comments/gspf10/anyone_still_using_grab_how_has_your_usage_of_it/,29,1590771867.0
Expat in S'pore does food delivery on bicycle & donates earnings to Children's Cancer Foundation,https://mothership.sg/2020/06/expat-grabfood-donation/,18,1591446527.0
"F&B owner on the maths behind food delivery services, and why you should order direct if you can",https://www.reddit.com/r/singapore/comments/g1bb8s/fb_owner_on_the_maths_behind_food_delivery/,98,1586918832.0
GrabFood Delivery fees $7.50? Did price increase?,https://i.redd.it/4xdp04zo68r41.jpg,61,1586219797.0
Best non-airmiles (cash back?) credit card in Singapore,https://www.reddit.com/r/singapore/comments/h8rrr2/best_nonairmiles_cash_back_credit_card_in/,23,1592161128.0
Deliveroo Plus started to implement $18 minimum order ahead of email notification timeline (which stated the minimum order would only be imposed in June),https://www.reddit.com/r/singapore/comments/gbfvn0/deliveroo_plus_started_to_implement_18_minimum/,23,1588358804.0
"/r/singapore random discussion and small questions thread for October 02, 2019",https://www.reddit.com/r/singapore/comments/dc0ot6/rsingapore_random_discussion_and_small_questions/,925,1569996285.0
"Non-compliant e-scooter riders not their staff, say food delivery companies",https://www.straitstimes.com/singapore/transport/non-compliant-e-scooter-riders-not-their-staff-say-food-delivery-companies,7,1588767446.0
Is it me or are the older generation more against food/grocery delivery?,https://www.reddit.com/r/singapore/comments/fz1ad6/is_it_me_or_are_the_older_generation_more_against/,44,1586626707.0
Minimum Basket Value and Platform Fees to be introduced from 13th March and 27th March respectively for GrabFood,https://i.imgur.com/6YbWgw8.jpg,22,1584029602.0
Well I just realized how strapped for cashflow I am as a restaurant runner with no dine in. When is the govt payment scheme coming in?,https://www.reddit.com/r/singapore/comments/fx0333/well_i_just_realized_how_strapped_for_cashflow_i/,34,1586350594.0
"With many of us staying at home due to CB, which restaurant/stalls offer the best delivery deals/bundles?",https://www.reddit.com/r/singapore/comments/fx3pmy/with_many_of_us_staying_at_home_due_to_cb_which/,16,1586368374.0
Please understand us.,https://www.reddit.com/r/singapore/comments/e2yhhj/please_understand_us/,97,1574978992.0
PSA to Singaporeans ordering food delivery for the fasting month.,https://www.reddit.com/r/singapore/comments/bl96ob/psa_to_singaporeans_ordering_food_delivery_for/,96,1557157939.0
$7k a month as a food delivery rider?,https://www.straitstimes.com/lifestyle/food/7k-a-month-as-a-food-delivery-rider,7,1587914578.0
Woman urges S’poreans to rethink cancelling orders after helping food delivery rider in wheelchair,https://mothership.sg/2019/12/foodpanda-wheelchair-bukit-purmei/,15,1577803889.0
Working as food delivery during covid,https://www.reddit.com/r/singapore/comments/gok6dm/working_as_food_delivery_during_covid/,6,1590185908.0
Best app to work for food delivery,https://www.reddit.com/r/singapore/comments/e8palu/best_app_to_work_for_food_delivery/,17,1576005005.0
Food options during Circuit Breaker,https://www.reddit.com/r/singapore/comments/gc0rcw/food_options_during_circuit_breaker/,6,1588424447.0
Grabfood sucks,https://www.reddit.com/r/singapore/comments/bk7ro3/grabfood_sucks/,60,1556914419.0
What it's like to be a food delivery rider,https://youtu.be/t9SHf4o5xwI,28,1566138275.0
I want to earn more money!,https://www.reddit.com/r/singapore/comments/f48z3b/i_want_to_earn_more_money/,13,1581799658.0
Which one most profitable food delivery service?,https://www.reddit.com/r/singapore/comments/c3nf9q/which_one_most_profitable_food_delivery_service/,13,1561222394.0
Compilation of the best food apps in Singapore,https://www.reddit.com/r/singapore/comments/byveew/compilation_of_the_best_food_apps_in_singapore/,15,1560184770.0
Sharing of experience for being a food delivery guy,https://www.reddit.com/r/singapore/comments/a31odh/sharing_of_experience_for_being_a_food_delivery/,21,1543966303.0
Can I install smart door bells with camera on my HDB door/gate?,https://www.reddit.com/r/singapore/comments/apf13q/can_i_install_smart_door_bells_with_camera_on_my/,15,1549910597.0
Food App War in Singapore. Deliveroo loss 16.9M on revenue of 11.5M in 2016 in Singapore,http://www.straitstimes.com/lifestyle/food/food-delivery-app-war-on-the-boil,34,1511190020.0
Food delivery war,https://www.reddit.com/r/singapore/comments/98bho5/food_delivery_war/,10,1534625817.0
Anyone using food delivery for elderly at home daily?,https://www.reddit.com/r/singapore/comments/bdq596/anyone_using_food_delivery_for_elderly_at_home/,14,1555421084.0
How is your experience with food delivery services?,https://www.reddit.com/r/singapore/comments/94newv/how_is_your_experience_with_food_delivery_services/,24,1533453919.0
