Title,Source,Date,Description,Link
Deliveroo aims to sell $1.4 billion of new shares in upcoming IPO,Reuters via Yahoo News Singapore,2021-03-15,Deliveroo said on Monday that it plans to sell around 1 billion pounds ($1.39 billion) of new shares...,https://sg.news.yahoo.com/deliveroo-aims-sell-1-4-071559418.html
The Real Cost of Food Delivery in Singapore,SingSaver via Yahoo Singapore Finance,2021-03-19,"How much more are you really paying when you order from foodpanda, GrabFood or Deliveroo? If online food delivery was a convenience before, the COVID-19...",https://sg.finance.yahoo.com/news/real-cost-food-delivery-singapore-071803384.html
Deliveroo aims to raise £1bn from London stock market flotation,The Guardian via Yahoo News,2021-03-15,Deliveroo is planning to raise £1bn from its stock market flotation. The meal delivery company...,https://sg.yahoo.com/finance/news/deliveroo-aims-raise-1bn-london-083447148.html
Uber grants UK drivers worker status in world first,AFP Relax via Yahoo Style Singapore,2021-03-17,"Uber on Tuesday said it is granting its UK drivers worker status, with benefits including a minimum wage -- a world first for the US ride-hailing giant....",https://sg.style.yahoo.com/uber-grants-uk-drivers-worker-012005349.html
"Uber prompts praise, and scepticism, after granting UK drivers worker status",AFP News via Yahoo News Singapore,2021-03-17,US ride-hailing giant Uber's decision to grant its UK drivers worker status won praise in Britain on...,https://sg.news.yahoo.com/uber-wins-praise-granting-uk-130029091.html
From Tipperary to Silicon Valley: how Stripe became vital cog in digital economy,The Guardian via Yahoo News,2021-03-17,"This has boosted Stripe’s valuation to a whopping $95bn, making it the most valuable of Silicon...",https://sg.yahoo.com/finance/news/tipperary-silicon-valley-stripe-became-060008163.html
"Citi Cash Back Card Review: 8% Cashback On Groceries And Petrol, 6% On Dining",SingSaver via Yahoo Singapore Finance,2021-03-15,If you're the head of the household with groceries and petrol as two of your key spending...,https://sg.finance.yahoo.com/news/citi-cash-back-card-review-013628679.html
Best Citibank Credit Cards In Singapore (2021),SingSaver via Yahoo Singapore Finance,2021-03-15,"Citibank boasts a credit card for every lifestyle need, with each being laden with top-shelf member privileges. Citibank is one of the most recognised...",https://sg.finance.yahoo.com/news/best-citibank-credit-cards-singapore-022506237.html
"Stripe continues cash haul, now valued at $95 billion",Associated Press via Yahoo Singapore Finance,2021-03-15,"The online payment company Stripe continues to attract investors, raising $600 million in funding to...",https://sg.finance.yahoo.com/news/stripe-raises-600m-company-valued-120126000.html
Vodafone to reap up to 2.3 billion euros from Frankfurt IPO,Reuters via Yahoo Singapore Finance,2021-03-17,"Vodafone has priced shares in infrastructure unit Vantage Towers at 24 euros each, valuing the firm...",https://sg.finance.yahoo.com/news/vodafone-seen-reaping-2-13-112817857.html
Courts close in on gig economy firms globally as workers seek rights,The Guardian via Yahoo News,2021-03-17,"Gig economy companies, including Uber and Deliveroo, have faced at least 40 major legal challenges...",https://sg.yahoo.com/finance/news/courts-close-gig-economy-firms-070009827.html
Uber grants UK drivers worker status in world first,Straits Times,2021-03-17,"Uber on Tuesday (March 16) said it is granting its UK drivers worker status, with benefits including a minimum wage - a world first for the US...",http://www.straitstimes.com/business/companies-markets/uber-grants-uk-drivers-worker-status-in-world-first
Uber grants UK drivers worker status in world first,Straits Times,2021-03-17,"Uber on Tuesday (March 16) said it is granting its UK drivers worker status, with benefits including a minimum wage - a world first for the US...",https://www.straitstimes.com/business/companies-markets/uber-grants-uk-drivers-worker-status-in-world-first
Amazon? Uber? Deliveroo? Just Eat? What employment terms are your drivers on?,Evening Standard via Yahoo News,2021-03-17,"Having been “self-employed” and therefore eligible for few benefits or guaranteed income, they will...",https://sg.yahoo.com/finance/news/amazon-uber-deliveroo-just-eat-094229872.html
Uber wins praise for granting UK drivers worker status,AFP via Yahoo Singapore Finance,2021-03-17,"US ride-hailing giant Uber won praise Wednesday from Britain's government and trade unions after granting UK drivers worker status with associated rights including a minimum wage, sparking hopes ...",https://sg.finance.yahoo.com/news/uber-wins-praise-granting-uk-130038272.html
Gig economy: Free ride is over as workers strike back,AFP via Yahoo Singapore Finance,2021-03-17,US ride-hailing giant Uber has granted its drivers workers' rights for the first time ever in a major U-turn in the UK. With the plight of workers in the gig economy coming under greater scrutiny ...,https://sg.finance.yahoo.com/news/gig-economy-free-ride-over-163631139.html
Uber grants UK drivers employee status in world first,AFP via Yahoo Singapore Finance,2021-03-17,"Uber on Tuesday said it is granting its UK drivers employee status, with benefits including a minimum wage -- a world first for the US ride-hailing giant. It is a massive change in the business ...",https://sg.finance.yahoo.com/news/uber-grants-uk-drivers-employee-210208822.html
Pressure on gig economy bosses to give their staff a fair deal after Uber u-turn over workers’...,Evening Standard via Yahoo News Singapore,2021-03-17,"The surprise decision prompted MPs, union leaders and employment lawyers to call on other gig...",https://sg.news.yahoo.com/pressure-gig-economy-bosses-staff-124422477.html
Evening Standard Comment: Now it’s time for all the gig firms to deliver,Evening Standard via Yahoo News Singapore,2021-03-17,"The digital revolution, like the first industrial revolution, has thrown up important questions...",https://sg.news.yahoo.com/evening-standard-now-time-gig-121553388.html
Global IPO market eyes record first quarter even as SPACs falter,Straits Times,2021-03-14,"The global market for initial public offerings is headed for its biggest-ever first quarter, even as...",http://www.straitstimes.com/business/companies-markets/global-ipo-market-eyes-record-first-quarter-even-as-spacs-falter
Lockdown lexicon: the weird words that defined the pandemic,Evening Standard via Yahoo News Singapore,2021-03-15,‘Lockdown: the act of confining prisoners to their cells’ says Google. This is the f***ing Shawshank...,https://sg.news.yahoo.com/lockdown-lexicon-weird-words-defined-101840411.html
Deliveroo announces £1bn London IPO,Yahoo Finance UK,2021-03-15,"Takeaway company Deliveroo on Monday morning confirmed its intention to float, saying that it will sell £1bn ($1.4bn) in new shares in its initial public...",https://sg.yahoo.com/finance/news/deliveroo-announces-1-bn-london-ipo-stock-market-floatation-083508765.html
Silicon Valley's Stripe valued at $95bn after fundraising,The Guardian via Yahoo News,2021-03-15,The digital payments firm Stripe has been valued at $95bn after a funding round that makes the...,https://sg.yahoo.com/finance/news/silicon-valleys-stripe-valued-95bn-101908184.html
Government employment tsar Matthew Taylor calls for law change on gig economy after Uber improves...,Evening Standard via Yahoo News,2021-03-17,The author of the government-commissioned Taylor Report into the gig economy today gave a cautious...,https://sg.yahoo.com/finance/news/government-employment-tsar-matthew-taylor-093648157.html
"Capital’s unicorn count soaring as tech firms raise billions for London IPOs, major Tech Nation...",Evening Standard via Yahoo News,2021-03-16,"Boris Johnson has said that he is ""immensely proud to lead a government that is so comprehensively...",https://sg.yahoo.com/finance/news/capital-unicorn-count-soaring-tech-092921423.html
Dija acquires Cambridge-based Genie to expand its 10-minute grocery service across UK,TechCrunch via Yahoo News Singapore,2021-03-17,"Founded by Alberto Menolascina and Yusuf Saban, who both spent a number of years at Deliveroo in...",https://sg.news.yahoo.com/dija-acquires-cambridge-based-genie-090007678.html
Uber facing up to $350m in new costs for UK drivers' pensions and holiday pay,The Telegraph via Yahoo News,2021-03-17,"Uber will easily absorb the cost of paying its 70,000 UK drivers holiday leave and pensions, new...",https://sg.yahoo.com/finance/news/uber-face-court-challenge-force-084943528.html
Bitcoin retreats from record high amid report of Indian crypto ban,Yahoo Finance UK,2021-03-15,Bitcoin (BTC-USD) was in retreat on Monday morning after hitting a new record high over the weekend....,https://sg.yahoo.com/finance/news/bitcoin-price-15-march-india-ban-094151343.html
"Stripe, payments company founded by Irish brothers, worth $95bn",Yahoo Finance UK,2021-03-15,"Payments company Stripe is now worth $95bn (£68bn) after raising $600m from investors. The company,...",https://sg.yahoo.com/finance/news/stripe-600m-raise-95bn-valuation-investment-europe-dublin-ireland-payments-fintech-085709738.html
"Instagram is ‘most invasive app’, new study shows",The Independent via Yahoo News,2021-03-17,Cloud storage firm pCloud made the discovery after analysing the recently introduced App Privacy labels that companies are now required to include within...,https://sg.yahoo.com/finance/news/instagram-most-invasive-app-study-171924983.html
"A year since the West End went dark, this is what the last twelve months have meant for theatre",Evening Standard via Yahoo News Singapore,2021-03-16,"Everyone in UK theatre remembers where they were on Monday, March 16th, 2020. Indira Varma was...",https://sg.news.yahoo.com/since-west-end-went-dark-121915234.html
Stripe founders' wealth more than doubles to $23bn,The Telegraph via Yahoo News,2021-03-15,Stripe's billionaire founders Patrick and John Collison have more than doubled their combined wealth to $22.8bn (£16.3bn) after closing a funding that...,https://sg.yahoo.com/finance/news/stripe-founders-wealth-more-doubles-221929171.html
London's Jiffy picks up £2.6M seed to enter the grocery dark store race,TechCrunch via Yahoo News Singapore,2021-03-16,"Another online grocery delivery and ""dark store"" operator breaks cover today: London-based Jiffy,...",https://sg.news.yahoo.com/londons-jiffy-picks-2-6m-155504524.html
"Equity Monday: Stripe's epic new valuation, Deliveroo's IPO and WeWork numbers",TechCrunch via Yahoo News Singapore,2021-03-15,"Hello and welcome back to Equity, TechCrunch’s venture capital-focused podcast where we unpack the...",https://sg.news.yahoo.com/equity-monday-stripes-epic-valuation-141806360.html
Stripe closes $600M round at a $95B valuation,TechCrunch via Yahoo News Singapore,2021-03-15,"The company has closed in on another $600 million, at a valuation of $95 billion. Stripe said it will use the funding to expand its business in Europe,...",https://sg.news.yahoo.com/stripe-closes-600m-round-95b-215913591.html
