content,author,date,retweets,likes,url
"The Real Cost of Food Delivery in SingaporeHow much more are you really paying when you order from foodpanda, GrabFood or Deliveroo? If online food delivery was a convenience before, the COVID-19...",SingSaver via Yahoo Singapore Finance,2021-03-19,,,https://sg.finance.yahoo.com/news/real-cost-food-delivery-singapore-071803384.html
Gift Cards To Get For Every Personality On Any OccasionTable of contents Why gift cards are a fantastic choice Gift vouchers for all types of personality...,SingSaver via Yahoo Singapore Finance,2021-03-19,,,https://sg.finance.yahoo.com/news/gift-cards-every-personality-occasion-030203540.html
Get Your Grub On with these Credit Card Dining Promos for 2021Credit Card Dining Promo Offers from Citibank Up to 50% off at Alba Restaurante Español Eligible...,MoneyMax.ph via Yahoo News Singapore,2021-03-18,,,https://sg.news.yahoo.com/grub-credit-card-dining-promos-030026825.html
"Citi Cash Back Card Review: 8% Cashback On Groceries And Petrol, 6% On DiningIf you're the head of the household with groceries and petrol as two of your key spending...",SingSaver via Yahoo Singapore Finance,2021-03-15,,,https://sg.finance.yahoo.com/news/citi-cash-back-card-review-013628679.html
"Best Citibank Credit Cards In Singapore (2021)Citibank boasts a credit card for every lifestyle need, with each being laden with top-shelf member privileges. Citibank is one of the most recognised...",SingSaver via Yahoo Singapore Finance,2021-03-15,,,https://sg.finance.yahoo.com/news/best-citibank-credit-cards-singapore-022506237.html
Save time and skip the grocery queues with 7-Eleven’s easy to cook All-in-One Meal Kits with...Choose from more than 20 different convenient meal kits including Asian favourites and Western...,MediaOutReach via Yahoo Singapore Finance,2021-03-19,,,https://sg.finance.yahoo.com/news/save-time-skip-grocery-queues-084500032.html
